place_id,name,description,is_spending_on_ads,reviews,website,owner_name,owner_profile_link,featured_image,main_category,categories,rating,workday_timing,closed_on,phone,address,review_keywords,link
ChIJs8lGyt1zhlQRssgeHveYgiU,Canadian Tire,,False,3991,https://www.canadiantire.ca/en/store-details/bc/cambie-7th-bc-389.html%3Futm_source%3Dgoogle%26utm_medium%3Dlss%26utm_content%3D389,Canadian Tire (Owner),https://www.google.com/maps/contrib/116649980637182005219,https://lh5.googleusercontent.com/p/AF1QipPgCBfrR56V3sJ-xLn7ANB78YDAV6eq2BRvtko3=w426-h240-k-no,Department store,"Department store, Auto parts store, Garden center, Home goods store, Home improvement store, Oil change service, Party store, Sporting goods store, Tire shop",3.7,9 a.m.-9 p.m.,,(604) 707-2290,"Canadian Tire, 2290 Cambie St, Vancouver, BC V5Z 2T7","bike, tires, tools, inspection, gardening, auto service, gear, brake, parking ticket, flyer",https://www.google.com/maps/place/Canadian+Tire/data=!4m7!3m6!1s0x548673ddca46c9b3:0x258298f71e1ec8b2!8m2!3d49.2652952!4d-123.1137803!16s%2Fg%2F1ts_68_2!19sChIJs8lGyt1zhlQRssgeHveYgiU?authuser=0&hl=en&rclk=1
ChIJkzFdwdF2hlQRgXWFwDJ5rhc,Canadian Tire,,False,3471,https://www.canadiantire.ca/en/store-details/bc/vancouver-grandview-boundary-bc-604.html%3Futm_source%3Dgoogle%26utm_medium%3Dlss%26utm_content%3D604,Canadian Tire (Owner),https://www.google.com/maps/contrib/118288223897786753708,https://lh5.googleusercontent.com/p/AF1QipPsH3wWihT_7YarJ70QLrxpG_FJbWhIS_7fdLGN=w426-h240-k-no,Department store,"Department store, Auto parts store, Garden center, Home goods store, Home improvement store, Oil change service, Party store, Sporting goods store, Tire shop",3.8,9 a.m.-9 p.m.,,(604) 431-3570,"Canadian Tire, 2830 Bentall St, Vancouver, BC V5M 4H4","self checkout, tires, auto service, hunting, wiper, van, mechanic, car battery, bulb, flyer",https://www.google.com/maps/place/Canadian+Tire/data=!4m7!3m6!1s0x548676d1c15d3193:0x17ae7932c0857581!8m2!3d49.2596026!4d-123.031032!16s%2Fg%2F1v41_4k3!19sChIJkzFdwdF2hlQRgXWFwDJ5rhc?authuser=0&hl=en&rclk=1
ChIJ_xBOrRl2hlQRUYgMDU3UUDo,Canadian Tire,,False,2390,https://www.canadiantire.ca/en/store-details/bc/burnaby-south-bc-603.html%3Futm_source%3Dgoogle%26utm_medium%3Dlss%26utm_content%3D603,Canadian Tire (Owner),https://www.google.com/maps/contrib/110522340426165424893,https://lh5.googleusercontent.com/p/AF1QipOaykGukarv0bgHoAItX8_px2S-K8bHREWtxNsZ=w408-h306-k-no,Department store,"Department store, Auto parts store, Garden center, Home goods store, Home improvement store, Oil change service, Party store, Sporting goods store, Tire shop",3.8,8 a.m.-9 p.m.,,(604) 451-5888,"Canadian Tire, Marine Way Market, 7200 Market Crossing, Burnaby, BC V5J 0A2","tools, inspection, auto service, backpack, winter tires, mechanic, flat tire, spoke, brake, wheel alignment",https://www.google.com/maps/place/Canadian+Tire/data=!4m7!3m6!1s0x54867619ad4e10ff:0x3a50d44d0d0c8851!8m2!3d49.2003223!4d-122.9826437!16s%2Fg%2F1tffjgjc!19sChIJ_xBOrRl2hlQRUYgMDU3UUDo?authuser=0&hl=en&rclk=1
ChIJHWzHwvF0hlQRb3btui47PZk,Canadian Tire,,False,2298,https://www.canadiantire.ca/en/store-details/bc/vancouver-sw-marine-bc-605.html%3Futm_source%3Dgoogle%26utm_medium%3Dlss%26utm_content%3D605,Canadian Tire (Owner),https://www.google.com/maps/contrib/113910109818817501964,https://lh5.googleusercontent.com/p/AF1QipPYfDr7NQYNbILkZ24KF4TfMSNGAXHn42yFRkTu=w426-h240-k-no,Department store,"Department store, Auto parts store, Garden center, Home goods store, Oil change service, Sporting goods store, Tire shop",3.9,8 a.m.-9 p.m.,,(604) 336-1086,"Canadian Tire, 8277 Ontario St, Vancouver, BC V5X 0A7","tires, tools, garden, auto service, walking, bike, battery, training, paint, BBQ",https://www.google.com/maps/place/Canadian+Tire/data=!4m7!3m6!1s0x548674f1c2c76c1d:0x993d3b2ebaed766f!8m2!3d49.2099093!4d-123.1075351!16s%2Fg%2F1w6r7zgf!19sChIJHWzHwvF0hlQRb3btui47PZk?authuser=0&hl=en&rclk=1
ChIJOeYve4BxhlQRfPFG8Wik9YI,Guu Original Thurlow,"Bustling izakaya offering inventive Japanese small plates to go with sake, beer & unique cocktails.",False,1837,https://guu-izakaya.com/Original_QR,Guu Original Thurlow (Owner),https://www.google.com/maps/contrib/117634537816088426326,https://lh5.googleusercontent.com/p/AF1QipM2gnl5g9Uk5E00-PuUsUu0Rv1hhSTE6x6GXlvW=w408-h306-k-no,Izakaya restaurant,"Izakaya restaurant, Japanese restaurant, Tapas restaurant",4.5,"11:30 a.m.-2 p.m., 5-11 p.m.",,(604) 685-8817,"Guu Original Thurlow, 838 Thurlow St, Vancouver, BC V6E 1W2","dishes, yaki udon, tapas, salmon, kimchi fried rice, beef tataki, small plates, chicken karaage, sashimi salad, jellyfish",https://www.google.com/maps/place/Guu+Original+Thurlow/data=!4m7!3m6!1s0x548671807b2fe639:0x82f5a468f146f17c!8m2!3d49.2840014!4d-123.1254447!16s%2Fg%2F1tfv4tq8!19sChIJOeYve4BxhlQRfPFG8Wik9YI?authuser=0&hl=en&rclk=1
ChIJwy3kCYhxhlQRVNbXqCU6bo0,Guu with Garlic,"Bustling izakaya offering inventive Japanese small plates to go with sake, beer & unique cocktails.",False,1500,https://guu-izakaya.com/Garlic_QR,Guu with Garlic (Owner),https://www.google.com/maps/contrib/105072771128399873120,https://lh5.googleusercontent.com/p/AF1QipMFNK58Ng10Os4CLKak9ENH7GcIPRCen_sUkWj4=w408-h272-k-no,Izakaya restaurant,"Izakaya restaurant, Japanese restaurant",4.4,"11:30 a.m.-2:30 p.m., 5-11:30 p.m.",,(604) 685-8678,"Guu with Garlic, 1698 Robson St, Vancouver, BC V6G 1C7","dishes, server, tapas, grilled, salmon, yaki udon, chef, hot pot, small plates, tuna tataki",https://www.google.com/maps/place/Guu+with+Garlic/data=!4m7!3m6!1s0x5486718809e42dc3:0x8d6e3a25a8d7d654!8m2!3d49.2901722!4d-123.1340053!16s%2Fg%2F1tdb8jjk!19sChIJwy3kCYhxhlQRVNbXqCU6bo0?authuser=0&hl=en&rclk=1
ChIJvQ6UDohxhlQR_XhiTxjYBZs,Jang Mo Jib Korean Restaurant,"Mini-chain serving Korean BBQ, rice, noodles & other staples in a low-key, wood-lined environment.",False,1132,http://jangmojib.com/,Jang Mo Jib Korean Restaurant (Owner),https://www.google.com/maps/contrib/103557190162996645181,https://lh5.googleusercontent.com/p/AF1QipNdcn89Wy1O-KWcEP8vUplspNHLdzQVAEfbyM5j=w408-h306-k-no,Korean restaurant,Korean restaurant,3.7,12 p.m.-2 a.m.,,(604) 642-0712,"Jang Mo Jib Korean Restaurant, 808 Bute St, Vancouver, BC V6E 1Y4","servers, karaoke, night, spicy, pork bone soup, hot pot, music, seafood pancake, bbq chicken, crowd",https://www.google.com/maps/place/Jang+Mo+Jib+Korean+Restaurant/data=!4m7!3m6!1s0x548671880e940ebd:0x9b05d8184f6278fd!8m2!3d49.2857582!4d-123.1271311!16s%2Fg%2F1thd6c8j!19sChIJvQ6UDohxhlQR_XhiTxjYBZs?authuser=0&hl=en&rclk=1
ChIJda43-9FzhlQR8bDraTrZvXo,Eat Bar & Patio Haraheri,"Bustling izakaya offering inventive Japanese small plates to go with sake, beer & unique cocktails.",False,1114,https://haraheri.ca/,Eat Bar & Patio Haraheri (Owner),https://www.google.com/maps/contrib/106242500110260664200,https://lh5.googleusercontent.com/p/AF1QipMz6bqae_-toVNfpgBLbfsYE_xs5lf6Kh8K7G7f=w426-h240-k-no,Modern izakaya restaurant,"Modern izakaya restaurant, Fusion restaurant, Japanese restaurant",4.3,"11:30 a.m.-2:30 p.m., 5:30-11 p.m.",,(604) 899-0855,"Eat Bar & Patio Haraheri, 888 Nelson St m101, Vancouver, BC V6Z 2H2","japanese, dishes, server, bento box, tataki, oden, cauliflower, mayo, duck, calamari",https://www.google.com/maps/place/Eat+Bar+%26+Patio+Haraheri/data=!4m7!3m6!1s0x548673d1fb37ae75:0x7abdd93a69ebb0f1!8m2!3d49.2800364!4d-123.1252786!16s%2Fg%2F11rrrx0f6h!19sChIJda43-9FzhlQR8bDraTrZvXo?authuser=0&hl=en&rclk=1
ChIJBaETatp2hlQRDATRPDj8Hvo,Burnaby Palace Restaurant,"Bright, classy space for traditional Chinese fare & dishes with a twist, plus online ordering.",False,1044,https://burnabypalace.ca/%3Futm_source%3Dgoogle%26utm_medium%3Dmaps%26utm_campaign%3Dwebsite,Burnaby Palace Restaurant (Owner),https://www.google.com/maps/contrib/101384396669955473652,https://lh5.googleusercontent.com/p/AF1QipPbMA5eX5atjyOKbFWrcOeXDAVcINuzx5xmeSmb=w408-h270-k-no,Chinese restaurant,Chinese restaurant,4.1,11 a.m.-9 p.m.,,(604) 437-1818,"Burnaby Palace Restaurant, 3110 Boundary Rd, Burnaby, BC V5M 4A2","delivery, ginger beef, chow mein, order, party, green beans, sweet and sour pork, lemon chicken, squid, black bean",https://www.google.com/maps/place/Burnaby+Palace+Restaurant/data=!4m7!3m6!1s0x548676da6a13a105:0xfa1efc383cd1040c!8m2!3d49.2562766!4d-123.0231189!16s%2Fg%2F1tg5z9_z!19sChIJBaETatp2hlQRDATRPDj8Hvo?authuser=0&hl=en&rclk=1
ChIJP0wBP3hxhlQR5bMiXWGm6Zs,Guu with Otokomae,"Bustling izakaya offering inventive Japanese small plates to go with sake, beer & unique cocktails.",False,923,https://guu-izakaya.com/Otokomae_QR,Guu with Otokomae (Owner),https://www.google.com/maps/contrib/108302592201069994159,https://lh5.googleusercontent.com/p/AF1QipOEIVMBOBizvEVPhOzVcn4C5wwrQkC9rtCEVPY=w408-h271-k-no,Izakaya restaurant,"Izakaya restaurant, Japanese restaurant",4.2,11:30 a.m.-11 p.m.,,(604) 685-8682,"Guu with Otokomae, 375 Water St #105, Vancouver, BC V6B 5C6","japanese, dishes, server, atmosphere, tapas, bibimbap, spicy, squid, happy hour, salmon",https://www.google.com/maps/place/Guu+with+Otokomae/data=!4m7!3m6!1s0x548671783f014c3f:0x9be9a6615d22b3e5!8m2!3d49.2847191!4d-123.1103983!16s%2Fg%2F1tf57k_j!19sChIJP0wBP3hxhlQR5bMiXWGm6Zs?authuser=0&hl=en&rclk=1
ChIJd4E0_6J2hlQR73I7GN7YJVU,Come Along Chinese Seafood Restaurant,"Bustling dining spot with bright decor, featuring familiar dim sum options & Chinese dishes.",False,587,https://comealongrestaurant.com/%3Futm_source%3Dgoogle%26utm_medium%3Dmaps%26utm_campaign%3Dwebsite,Come Along Chinese Seafood Restaurant (Owner),https://www.google.com/maps/contrib/102397695620784591502,https://lh5.googleusercontent.com/p/AF1QipO4nC7CaWVI6Xcs8fBCeehGb2oPejSwMxPLmz_p=w408-h306-k-no,Chinese restaurant,Chinese restaurant,3.9,"10 a.m.-2:30 p.m., 5-9 p.m.",Thursday,(604) 439-1318,"Come Along Chinese Seafood Restaurant, 2550 Kingsway, Vancouver, BC V5R 5H2","dim sum, parking, dinner, squid, deep fried, portion sizes, solid, rice roll, discount, attitude",https://www.google.com/maps/place/Come+Along+Chinese+Seafood+Restaurant/data=!4m7!3m6!1s0x548676a2ff348177:0x5525d8de183b72ef!8m2!3d49.2393583!4d-123.0531139!16s%2Fg%2F1trpqh4h!19sChIJd4E0_6J2hlQR73I7GN7YJVU?authuser=0&hl=en&rclk=1
ChIJ2y8xHh50hlQRWhRBYqcleik,Kalvin's Restaurant ( Song Lin Ju  ),,False,579,https://kalvinrestaurant.ca/,Kalvin's Restaurant ( Song Lin Ju  ) (Owner),https://www.google.com/maps/contrib/114165027630260928955,https://lh5.googleusercontent.com/p/AF1QipPBLtb1Cxlonwtnr-hJNq-T5B_jvcYyfslLdAWT=w408-h305-k-no,Taiwanese restaurant,"Taiwanese restaurant, Chinese restaurant, Sichuan restaurant",4.3,"11:30 a.m.-2:30 p.m., 5:30-9:30 p.m.",Wednesday,(604) 321-2888,"Kalvin's Restaurant ( Song Lin Ju  ), 5225 Victoria Dr, Vancouver, BC V5P 3V4","cash, szechuan, sanbeiji, dumplings, xiao long bao, dining, pancake, duck, frozen, hot pot",https://www.google.com/maps/place/Kalvin%27s+Restaurant+%28+%E6%9D%BE%E6%9E%97%E5%B1%85+%29/data=!4m7!3m6!1s0x5486741e1e312fdb:0x297a25a76241145a!8m2!3d49.2372604!4d-123.0656879!16s%2Fg%2F1vnrq978!19sChIJ2y8xHh50hlQRWhRBYqcleik?authuser=0&hl=en&rclk=1
ChIJP9fhj8Z2hlQRkXBMcmjdJPw,ETEA cafe,,False,433,http://etea.zomi.menu/,ETEA cafe (Owner),https://www.google.com/maps/contrib/112392816610331812251,https://lh5.googleusercontent.com/p/AF1QipOKJYyEGR95nRAS_Z3qEZaG891T1JOyItig67RM=w408-h306-k-no,Taiwanese restaurant,"Taiwanese restaurant, Bubble tea store",3.8,11 a.m.-10:30 p.m.,,(604) 968-3832,"ETEA cafe, 3281 E 22nd Ave, Vancouver, BC V5M 2Z1","bubble tea, popcorn chicken, mango, pork chop, thai chicken fried rice, slush, baked, spicy, curry, portion size",https://www.google.com/maps/place/ETEA+cafe/data=!4m7!3m6!1s0x548676c68fe1d73f:0xfc24dd68724c7091!8m2!3d49.2509215!4d-123.0344337!16s%2Fg%2F1thhk609!19sChIJP9fhj8Z2hlQRkXBMcmjdJPw?authuser=0&hl=en&rclk=1
ChIJZcRLveFxhlQR1SFI-Om2P8g,Sal y Limon,,False,297,https://www.salylimon.ca/,Sal y Limon (Owner),https://www.google.com/maps/contrib/114945560384949407504,https://lh5.googleusercontent.com/p/AF1QipOt6dAIm9_obFLqFiN5aWp3FL0gQJk4aSshm6_e=w408-h306-k-no,Mexican restaurant,Mexican restaurant,4.2,11 a.m.-9 p.m.,,(604) 428-6223,"Sal y Limon, 1752 Commercial Dr, Vancouver, BC V5N 4A3","horchata, carnitas, lengua, lamb, churros, fish, chorizo, margarita, chimichanga, torta",https://www.google.com/maps/place/Sal+y+Limon/data=!4m7!3m6!1s0x548671e1bd4bc465:0xc83fb6e9f84821d5!8m2!3d49.2688558!4d-123.0694371!16s%2Fg%2F11pwm4nrrn!19sChIJZcRLveFxhlQR1SFI-Om2P8g?authuser=0&hl=en&rclk=1
ChIJJ19lwkFzhlQRGXt2bHZcRpQ,Guu Davie,"Bustling izakaya offering inventive Japanese small plates to go with sake, beer & unique cocktails.",False,276,https://guu-izakaya.com/Davie_QR,Guu Davie (Owner),https://www.google.com/maps/contrib/100836385820769803745,https://lh5.googleusercontent.com/p/AF1QipO7s-0B-p63KsZqQCL17PA6JBLS3bNP8VJXf1dM=w408-h306-k-no,Izakaya restaurant,"Izakaya restaurant, Japanese restaurant",4.3,5 p.m.-12 a.m.,,(604) 687-8890,"Guu Davie, 1239 Davie St, Vancouver, BC V6E 1N4","dishes, oysters, server, japanese, oden, shabu shabu, happy hour, atmosphere, sauce, wagyu",https://www.google.com/maps/place/Guu+Davie/data=!4m7!3m6!1s0x54867341c2655f27:0x94465c766c767b19!8m2!3d49.2822394!4d-123.1337752!16s%2Fg%2F11grtqqzgr!19sChIJJ19lwkFzhlQRGXt2bHZcRpQ?authuser=0&hl=en&rclk=1
ChIJyUSB_rpxhlQRv9JcmNZXBsk,Gong Cha,,False,230,https://www.gongchacanada.ca/locations-1,Gong Cha (Owner),https://www.google.com/maps/contrib/108862528849170226418,https://lh5.googleusercontent.com/p/AF1QipOI7TFdx4KYa3R_OrQkQ9wOOD8Y4NuBvkMquoZ6=w408-h305-k-no,Bubble tea store,Bubble tea store,4.2,11:30 a.m.-10 p.m.,,(604) 423-4995,"Gong Cha, 2887 E 12th Ave, Vancouver, BC V5M 4T5","bubble waffle, flavour, sweet, price, matcha, brown sugar, app, lady, grass jelly, straws",https://www.google.com/maps/place/Gong+Cha/data=!4m7!3m6!1s0x548671bafe8144c9:0xc90657d6985cd2bf!8m2!3d49.2593263!4d-123.045171!16s%2Fg%2F11j0j93y87!19sChIJyUSB_rpxhlQRv9JcmNZXBsk?authuser=0&hl=en&rclk=1
ChIJu9A8CcJxhlQRVEvt0cy4TUM,Hon's Wonton House - Broadway Station,,False,172,http://honswontonhouse.com/,Hon's Wonton House - Broadway Station (Owner),https://www.google.com/maps/contrib/106960626444174294028,https://lh5.googleusercontent.com/p/AF1QipMGrDE58QOS4dgHZw6diGlvlwNByg7Ak-leUxFk=w408-h306-k-no,Chinese restaurant,"Chinese restaurant, Takeout Restaurant, Noodle shop",3.8,11 a.m.-10 p.m.,,(604) 873-4600,"Hon's Wonton House - Broadway Station, 1661 E Broadway, Vancouver, BC V5N 1V9","price, bbq pork, broth, brisket, wonton soup, salty, dim sum, olympic, wonton noodle soup, bowl",https://www.google.com/maps/place/Hon%27s+Wonton+House+-+Broadway+Station/data=!4m7!3m6!1s0x548671c2093cd0bb:0x434db8ccd1ed4b54!8m2!3d49.2624958!4d-123.0707055!16s%2Fg%2F11fvbrwvs4!19sChIJu9A8CcJxhlQRVEvt0cy4TUM?authuser=0&hl=en&rclk=1
ChIJA6sF7hW8hVQR3DusTqm4HvU,Kowloon Inn,,False,161,https://kowlooninn.com/,Kowloon Inn (Owner),,https://lh5.googleusercontent.com/p/AF1QipNExbSakDclkB-Tez4cdtYbTZkNop90oQU_hB2e=w426-h240-k-no,Chinese restaurant,"Chinese restaurant, Asian restaurant",4,3-8 p.m.,"Monday, Sunday",+1 360-384-4600,"Kowloon Inn, 5625 3rd Ave, Ferndale, WA 98248, United States","price, waitress, almond chicken, chow mein, buffet, asian food",https://www.google.com/maps/place/Kowloon+Inn/data=!4m7!3m6!1s0x5485bc15ee05ab03:0xf51eb8a94eac3bdc!8m2!3d48.8459768!4d-122.5944069!16s%2Fg%2F1tdd9jq4!19sChIJA6sF7hW8hVQR3DusTqm4HvU?authuser=0&hl=en&rclk=1
ChIJ2dJtFdhxhlQRmhVCOdPtGrQ,Guu Toramasa,,False,65,https://guu-izakaya.com/Toramasa_QR,Guu Toramasa (Owner),https://www.google.com/maps/contrib/103546989016619414212,https://lh5.googleusercontent.com/p/AF1QipPap5E1ywejtn3bkIywZvIIn1mI8z-VB-uAjTS_=w408-h415-k-no,Japanese restaurant,Japanese restaurant,4.2,"11:30 a.m.-2 p.m., 5-11 p.m.",,(604) 900-1002,"Guu Toramasa, 757 Seymour St, Vancouver, BC V6B 5J3","dishes, izakaya, price, atmosphere, servers, takoyaki, selection, dinner",https://www.google.com/maps/place/Guu+Toramasa/data=!4m7!3m6!1s0x548671d8156dd2d9:0xb41aedd33942159a!8m2!3d49.2811586!4d-123.1185545!16s%2Fg%2F11kbs5_7bv!19sChIJ2dJtFdhxhlQRmhVCOdPtGrQ?authuser=0&hl=en&rclk=1
ChIJYSUB8El4hlQRT2hZTZhldHo,Sol Lee's Korean Restaurant,,False,387,,Sol Lee's Korean Restaurant (Owner),https://www.google.com/maps/contrib/103753877353983945454,https://lh5.googleusercontent.com/p/AF1QipMp_qgQg6_XycBeoSsNIpUc3-cD7j3-P0mWL-Z1=w408-h544-k-no,Korean restaurant,"Korean restaurant, Seafood restaurant",4.3,11 a.m.-10 p.m.,,(604) 931-8460,"Sol Lee's Korean Restaurant, 329 North Rd Unit 550, Coquitlam, BC V3K 3V8","agujjim, dishes, spicy, dabs, pork bone soup, hot pot, deep fried, cod, seafood tofu soup, halibut",https://www.google.com/maps/place/Sol+Lee%27s+Korean+Restaurant/data=!4m7!3m6!1s0x54867849f0012561:0x7a7465984d59684f!8m2!3d49.2439319!4d-122.8901685!16s%2Fg%2F11h9rr8yc_!19sChIJYSUB8El4hlQRT2hZTZhldHo?authuser=0&hl=en&rclk=1
